<?xml version="1.0" encoding="UTF-8"?>
<biblioteca xmlns:xs="http://www.w3.org/2001/XMLSchema-instance"
        xs:noNamespaceSchemaLocation="../xsd/biblioteca.xsd">
    <!-- Estructura de un <libro> clasificacion = "novela | infantil | didáctico"-->
    <libro id="L0001" tipo_clase ="novela" paginas="10">
        <titulo>Titulo del libro</titulo>
        <capitulo paginas="1">
            <titulo>Titulo del capitulo</titulo>
            <contenido enlace="https://www.google.es/">Lorem ipsum</contenido>
        </capitulo>
        <capitulo paginas="7">
            <titulo>Titulo del capitulo</titulo>
            <contenido enlace="https://www.google.es/">Lorem ipsum</contenido>
        </capitulo>
        <indice>Indice del libro</indice>
        <sinopsis>Resumen del libro</sinopsis>
    </libro>

    <!-- Estructura de una <revista> clasificacion = "informática | corazón | coches | investigación | otras" -->
    <revista id="R0000" tipo_clase="investigación" paginas="1">
        <titulo>Título de la revista</titulo>
        <numero>1</numero>
        <indice>
            <encabezado>Encabezado</encabezado>
            <apartado titulo="La historia de Edix " pagina="1" />
            <apartado titulo="La historia de Edix " pagina="3" />
        </indice>
        <seccion paginas="1">
            <contenido enlace="https://www.google.es/">Contenido de la revista</contenido>
        </seccion>
    </revista>

    <!-- Estructura de un <periodico> clasificacion = "nacional | internaciona"-->
    <periodico id="P0001" tipo_clase="nacional" fecha_publicacion="1997-10-29">
        <indice>Indice periodico</indice>
        <seccion tipo="internacional"> <!-- tipo="economía | opinión | deportes | nacional |internacional" -->
            <articulo autor="a"></articulo>
            <contenido referencia="https://www.google.es/">Informacion</contenido>
        </seccion>
        
    </periodico>

</biblioteca>